{
  "behavior_domain": "skill-motion-review",
  "behavior_sha256": "ace9e40bbed036f9ac7d42be3728aeee82b32e9702b09af51be6195e5a1708e0",
  "behavior_source_dirty": false,
  "command": "codex exec --ephemeral --sandbox read-only --skip-git-repo-check --ignore-rules -C '$BENCHMARK_WORKSPACE' --model gpt-6-astra -c 'model_reasoning_effort=\"medium\"' --output-last-message '$BENCHMARK_WORKSPACE/.design-craft-host-output.md' -",
  "cwd": "$BENCHMARK_WORKSPACE",
  "duration_seconds": 95.1,
  "host": "codex",
  "host_version": "codex-cli 0.162.1",
  "model": "gpt-6-astra",
  "model_observation": "requested_by_cli",
  "output_path": "codex-output.md",
  "output_sha256": "bca8f0a12ad86110a018f2875e53417e4a010fe75544228ebb4fea6a2a246afe",
  "projected_skill_tree_sha256": "e4adc193c6827ce3f8ac1fe4236893625cf1280decfd09d821dc725032f5b280",
  "prompt_path": "prompt.md",
  "prompt_sha256": "15b25396696901c46fd0dde92cd556d10f30179ca38df969ab796228ce6d207f",
  "prompt_transport": "stdin",
  "reasoning_observation": "requested_by_cli",
  "reasoning_profile": "medium",
  "returncode": 0,
  "runner_os": "macOS-27.0.1-arm64-arm-64bit-Mach-O",
  "schema": "design-craft.cross-agent-run.v3",
  "skill_install_mode": "isolated_domain_projection",
  "skill_path": "$BENCHMARK_WORKSPACE/.agents/skills/design-craft",
  "source_skill_tree_sha256": "15dc56c7ce1068cde2a6e8c1eb2fc42e9a9c676ce6c4525d638f5d94e72be73a",
  "started_at": "2026-10-11T14:07:41Z",
  "stderr_bytes": 73691,
  "stderr_sha256": "d7ab1ec755f54052a4f235a4a06a25bcdba4110c9fea3f19fb0c1e5af6cc9fbc",
  "timeout_seconds": 2400,
  "workspace_kind": "repo_external_isolated_project",
  "worktree_after_sha256": "005c10d0889f45bcaa5d363b806fd1727451c29809361a9deef142ee8458f616",
  "worktree_before_sha256": "005c10d0889f45bcaa5d363b806fd1727451c29809361a9deef142ee8458f616",
  "worktree_unchanged": true
}
