{
  "behavior_domain": "skill-motion-review",
  "behavior_sha256": "ad51a65df0c61a97a6e8b6c61127e96f7408fbb67e46af5ee170aa6d1d2de621",
  "behavior_source_dirty": false,
  "command": "pi --print --no-session --no-skills --skill '$BENCHMARK_SKILL' --no-context-files --tools read,grep,find,ls --model codex/gpt-5.5 --thinking high",
  "cwd": "$BENCHMARK_WORKSPACE",
  "duration_seconds": 50.782,
  "host": "pi",
  "host_version": "0.80.6",
  "model": "codex/gpt-5.5",
  "model_observation": "requested_by_cli",
  "output_path": "pi-output.md",
  "output_sha256": "e36ebc2974c4f6a1181db3f515d605ecd90ac1dbb5da5c70d39eb84af3cf81c6",
  "projected_skill_tree_sha256": "6109f47269d38f29a10aefcce9ae7f9e507361ff241e6ce6b8af2e8d58376d75",
  "prompt_path": "prompt.md",
  "prompt_sha256": "15b25396696901c46fd0dde92cd556d10f30179ca38df969ab796228ce6d207f",
  "prompt_transport": "argument",
  "reasoning_observation": "requested_by_cli",
  "reasoning_profile": "high",
  "returncode": 0,
  "runner_os": "macOS-27.0-arm64-arm-64bit-Mach-O",
  "schema": "design-craft.cross-agent-run.v3",
  "skill_install_mode": "isolated_domain_projection",
  "skill_path": "$BENCHMARK_WORKSPACE/.pi/skills/design-craft",
  "source_skill_tree_sha256": "8da53f99d4ac651deeb72b63faf8c6522d009ea69e5aee5e9362e2a89fc1105b",
  "started_at": "2026-09-19T12:03:13Z",
  "stderr_bytes": 0,
  "stderr_sha256": "e3b0c44298fc1c149afbf4c8996fb92427ae41e4649b934ca495991b7852b855",
  "timeout_seconds": 600,
  "workspace_kind": "repo_external_isolated_project",
  "worktree_after_sha256": "3caa1eaa5a33dc127ed5f5ba58aaa8cf239cc83ff1ed9c89408be40984804db6",
  "worktree_before_sha256": "3caa1eaa5a33dc127ed5f5ba58aaa8cf239cc83ff1ed9c89408be40984804db6",
  "worktree_unchanged": true
}
